{
  "schema_version": "1.0.0",
  "idempotency_key": "igem2026-reporter-run-07",
  "name": "Bicistronic reporter + chaperone, low burden",
  "host_id": "escherichia_coli:562/K-12_MG1655",
  "condition_id": "cond_lb_37c_exp",
  "input": {
    "kind": "construct",
    "construct_context": {
      "schema_version": "1.0.0",
      "construct_id": "cons_demo_bicistron",
      "name": "Demo bicistronic reporter + chaperone",
      "host_id": "escherichia_coli:562/K-12_MG1655",
      "topology": "circular",
      "full_sequence": "AAAGAGGAGAAAGATCTATGAAACGTATTCTGTAAGGATCTAAAGAGGAGAAATACTAGATGGCAGAACTGAAATAACCAGGCATCAAATAAAACGAAAGGCTCAGTCGAAAGACTGGGCC",
      "vector": { "backbone_id": "pSB1C3", "copy_number": 100.0, "origin": "pMB1", "selection_marker": "CmR" },
      "elements": [
        { "element_id": "el_rbs1", "kind": "rbs", "span": { "start_nt": 0, "end_nt": 17, "strand": "+" }, "editable": false, "name": "B0034-like RBS", "metadata": { "part_registry_id": "BBa_B0034", "strength_class": "strong", "spacer_length_nt": 7 } },
        { "element_id": "el_cds1", "kind": "cds", "span": { "start_nt": 17, "end_nt": 35, "strand": "+" }, "editable": true, "name": "reporter" },
        { "element_id": "el_spacer1", "kind": "spacer", "span": { "start_nt": 35, "end_nt": 41, "strand": "+" }, "editable": false, "name": "intergenic" },
        { "element_id": "el_rbs2", "kind": "rbs", "span": { "start_nt": 41, "end_nt": 62, "strand": "+" }, "editable": false, "name": "weak RBS", "metadata": { "strength_class": "weak", "spacer_length_nt": 8 } },
        { "element_id": "el_cds2", "kind": "cds", "span": { "start_nt": 62, "end_nt": 83, "strand": "+" }, "editable": true, "name": "chaperone" },
        { "element_id": "el_term", "kind": "terminator", "span": { "start_nt": 83, "end_nt": 120, "strand": "+" }, "editable": false, "name": "B0015-like terminator" }
      ],
      "cistrons": [
        { "cistron_id": "cis_reporter", "cds_element_id": "el_cds1", "rbs_element_id": "el_rbs1", "is_design_target": true, "expected_relative_expression": 1.0, "expression_prior_source": "rbs_strength_model", "priority_weight": 1.0, "operon_group": "op_main" },
        { "cistron_id": "cis_chaperone", "cds_element_id": "el_cds2", "rbs_element_id": "el_rbs2", "is_design_target": true, "expected_relative_expression": 0.25, "expression_prior_source": "rbs_strength_model", "priority_weight": 0.5, "operon_group": "op_main" }
      ],
      "assembly": { "standard": "golden_gate_bsai", "forbidden_enzymes": ["BsaI", "BsmBI"], "vendor_profile": "twist" },
      "digest": "sha256:deadbeefcafe1234deadbeefcafe1234deadbeefcafe1234deadbeefcafe1234"
    }
  },
  "objectives": [
    { "term_id": "epistasis.dwell_deviation", "role": "pareto_axis" },
    { "term_id": "structure.local_accessibility", "role": "pareto_axis" },
    { "term_id": "burden.growth_cost", "role": "pareto_axis" },
    { "term_id": "usage.cai", "role": "pareto_axis" },
    { "term_id": "lm.naturalness", "role": "epsilon_constraint", "bound": -3.5, "bound_sense": "at_least" },
    { "term_id": "kinetics.pause_concordance", "role": "diagnostic" }
  ],
  "objectives_preset": "none",
  "constraint_set": {
    "schema_version": "1.0.0",
    "constraint_set_id": "cst_goldengate_twist_default",
    "name": "Golden Gate (BsaI) + Twist synthesis limits",
    "derived_from": ["assembly_standard", "vendor_profile"],
    "constraints": [
      { "id": "c_bsai", "class": "blocking", "scope": "construct", "rule": { "kind": "restriction_site", "enzyme": "BsaI", "site": "GGTCTC", "strand": "both", "max_occurrences": 0 } },
      { "id": "c_kmer8", "class": "blocking", "scope": "construct", "rule": { "kind": "kmer_repeat", "k": 8, "max_occurrences": 2, "count_overlapping": true, "canonical_strand": false } },
      { "id": "c_homopolymer", "class": "blocking", "scope": "construct", "rule": { "kind": "homopolymer", "base": "any", "max_run": 6 } }
    ],
    "repair_policy": {
      "max_window_codons": 12,
      "max_escalations": 2,
      "max_depth": 3,
      "beam_width": 32,
      "tabu_tenure_generations": 5,
      "objective_aware": true,
      "stochastic_tie_break": true,
      "lamarckian": true
    },
    "digest": "sha256:5566778899aabbcc5566778899aabbcc5566778899aabbcc5566778899aabbcc"
  },
  "seeds": null,
  "search": {
    "tiers": ["tier1_seed", "tier2_block_ca", "tier3_moea"],
    "population_size": 200,
    "max_generations": 300,
    "block_size_codons": 30,
    "n_restarts": 32,
    "joint_search": true,
    "termination": {
      "hypervolume_stagnation_generations": 30,
      "hypervolume_relative_epsilon": 0.001,
      "max_wall_seconds": 900
    }
  },
  "budget": { "tier": "standard", "max_wall_seconds": 900, "max_threads": 8, "allow_gpu": true },
  "model_pins": {},
  "replay_lockfile_digest": null,
  "allow_host_fallback": true,
  "output": {
    "max_candidates": 20,
    "reduction_method": "reference_direction_representatives",
    "include_per_position_rationale": true,
    "include_full_front_uri": true
  },
  "seed": 20260825,
  "webhook_url": null
}
